{
  "provider":"google","model":"gemini-3.8-live","aliases":[],"availability":"ga",
  "releasedAt":"2026-09-15T00:00:00Z","verifiedAt":"2026-09-20T00:00:00Z","staleAfterDays":30,
  "contextWindowTokens":131072,"maxOutputTokens":65536,"knowledgeCutoff":null,
  "inputModalities":["text","image","audio","video"],"outputModalities":["text","audio"],
  "apiSurfaces":["live"],"preferredApiSurface":"live",
  "reasoning":{"support":"supported","modes":["interleaved"],"defaultMode":"interleaved","adaptive":"unknown","alwaysOn":true,"manualBudgetSupported":false},
  "tools":{"functionCalling":"supported","structuredOutput":"unsupported","parallelFunctionCalling":"unknown","codeExecution":"unsupported","computerUse":"unknown","mcp":"unknown","namedTools":["function-calling","search-grounding","audio-generation"]},
  "requestConstraints":{"deprecatedParameters":[],"rejectedParameters":["thinking_level","thinking_config","proactive_audio:false","enable_affective_dialog"],"ignoredParameters":[],"unsupportedParameters":[],"unsupportedTurnPatterns":[],"parameterMigrations":[],"notes":["Function calling supports BLOCKING and NON_BLOCKING behavior; NON_BLOCKING is the default.","Proactive audio is permanently enabled.","File search and URL context are not supported.","Structured outputs and code execution are not supported."]},
  "tokenizerNotes":[],"declaredSources":[
    {"kind":"official-release","reference":"https://ai.google.dev/gemini-api/docs/changelog","observedAt":"2026-09-20T00:00:00Z"},
    {"kind":"official-doc","reference":"https://ai.google.dev/gemini-api/docs/models/gemini-3.8-live","observedAt":"2026-09-20T00:00:00Z"},
    {"kind":"official-doc","reference":"https://ai.google.dev/gemini-api/docs/live-api/thinking","observedAt":"2026-09-20T00:00:00Z"}
  ]
}