{
  "provider":"anthropic","model":"claude-fable-5-1","aliases":[],"availability":"ga",
  "releasedAt":"2026-09-01T00:00:00Z","verifiedAt":"2026-09-20T00:00:00Z","staleAfterDays":30,
  "contextWindowTokens":1000000,"maxOutputTokens":128000,"knowledgeCutoff":"2026-06",
  "inputModalities":["text","image"],"outputModalities":["text"],
  "apiSurfaces":["messages"],"preferredApiSurface":"messages",
  "reasoning":{"support":"supported","modes":["low","medium","high","xhigh","max"],"defaultMode":"high","adaptive":"supported","alwaysOn":true,"manualBudgetSupported":false},
  "tools":{"functionCalling":"supported","structuredOutput":"unknown","parallelFunctionCalling":"unknown","codeExecution":"unknown","computerUse":"unknown","mcp":"unknown","namedTools":[]},
  "requestConstraints":{"deprecatedParameters":[],"rejectedParameters":[],"ignoredParameters":[],"unsupportedParameters":["forced-tool-use"],"unsupportedTurnPatterns":[],"parameterMigrations":[],"notes":["Forced tool use returns an error on Claude Fable 5.1.","Per-message effort, turn-scoped system messages, readable progress updates between tool calls, and content provenance are documented additions.","Earlier Claude models cannot read Claude Fable 5.1 thinking blocks; editing earlier turns invalidates those thinking blocks."]},
  "tokenizerNotes":[],"declaredSources":[
    {"kind":"official-doc","reference":"https://platform.claude.com/docs/en/models/fable-5-1/overview","observedAt":"2026-09-20T00:00:00Z"},
    {"kind":"official-doc","reference":"https://platform.claude.com/docs/en/about-claude/models/choosing-a-model","observedAt":"2026-09-20T00:00:00Z"}
  ]
}