{
  "provider": "xai",
  "model": "grok-4.7",
  "aliases": [],
  "availability": "ga",
  "releasedAt": "2026-09-21T00:00:00Z",
  "verifiedAt": "2026-09-22T00:00:00Z",
  "staleAfterDays": 30,
  "contextWindowTokens": 500000,
  "maxOutputTokens": null,
  "knowledgeCutoff": null,
  "inputModalities": [
    "text",
    "image"
  ],
  "outputModalities": [
    "text"
  ],
  "apiSurfaces": [
    "responses",
    "chat-completions"
  ],
  "preferredApiSurface": "responses",
  "reasoning": {
    "support": "supported",
    "modes": [
      "low",
      "medium",
      "high",
      "xhigh"
    ],
    "defaultMode": "high",
    "adaptive": "unknown",
    "alwaysOn": true,
    "manualBudgetSupported": false
  },
  "tools": {
    "functionCalling": "supported",
    "structuredOutput": "supported",
    "parallelFunctionCalling": "unknown",
    "codeExecution": "unknown",
    "computerUse": "unknown",
    "mcp": "unknown",
    "namedTools": []
  },
  "requestConstraints": {
    "deprecatedParameters": [],
    "rejectedParameters": [],
    "ignoredParameters": [],
    "unsupportedParameters": [],
    "unsupportedTurnPatterns": [],
    "parameterMigrations": [],
    "notes": [
      "xAI documents a 500,000-token context window for Grok 4.7.",
      "xAI documents no text output limit for Grok 4.7.",
      "Reasoning effort supports low, medium, high, and xhigh; high is the default.",
      "On the Responses API, Grok 4.7 always returns reasoning.encrypted_content even when include does not list it.",
      "Grok 4.7 Fast is the same model at twice the token rates and is not available on the public xAI API."
    ]
  },
  "tokenizerNotes": [],
  "declaredSources": [
    {
      "kind": "official-release",
      "reference": "https://docs.x.ai/developers/release-notes",
      "observedAt": "2026-09-22T00:00:00Z"
    },
    {
      "kind": "official-doc",
      "reference": "https://docs.x.ai/developers/models/grok-4.7",
      "observedAt": "2026-09-22T00:00:00Z"
    },
    {
      "kind": "official-release",
      "reference": "https://x.ai/news/grok-4-7",
      "observedAt": "2026-09-22T00:00:00Z"
    },
    {
      "kind": "official-doc",
      "reference": "https://docs.x.ai/developers/model-capabilities/text/structured-outputs",
      "observedAt": "2026-09-22T00:00:00Z"
    }
  ]
}
