{
  "provider": "google",
  "model": "gemini-3.8-flash",
  "aliases": [],
  "availability": "ga",
  "releasedAt": "2026-09-02T00:00:00Z",
  "verifiedAt": "2026-09-03T00:00:00Z",
  "staleAfterDays": 30,
  "contextWindowTokens": 1048576,
  "maxOutputTokens": 65536,
  "knowledgeCutoff": null,
  "inputModalities": ["text", "image", "video", "audio", "pdf"],
  "outputModalities": ["text"],
  "apiSurfaces": ["interactions", "generate-content"],
  "preferredApiSurface": "interactions",
  "reasoning": {
    "support": "supported",
    "modes": ["low", "medium", "high"],
    "defaultMode": "medium",
    "adaptive": "unknown",
    "alwaysOn": null,
    "manualBudgetSupported": false
  },
  "tools": {
    "functionCalling": "supported",
    "structuredOutput": "supported",
    "parallelFunctionCalling": "unknown",
    "codeExecution": "supported",
    "computerUse": "preview",
    "mcp": "unknown",
    "namedTools": [
      "code-execution",
      "computer-use-preview",
      "file-search",
      "function-calling",
      "google-maps-grounding",
      "search-grounding",
      "url-context"
    ]
  },
  "requestConstraints": {
    "deprecatedParameters": ["temperature", "top_p", "top_k"],
    "rejectedParameters": [],
    "ignoredParameters": [],
    "unsupportedParameters": ["candidate_count"],
    "unsupportedTurnPatterns": ["prefilled-model-turn"],
    "parameterMigrations": [
      {
        "from": "thinking_budget",
        "to": "thinking_level",
        "action": "review",
        "note": "Replace numeric thinking budgets with thinking_level. Gemini 3.8 Flash supports low, medium, and high; medium is the default and minimal is unsupported."
      }
    ],
    "notes": [
      "thinking_level=minimal is unsupported on Gemini 3.8 Flash and returns an error.",
      "Remove temperature, top_p, and top_k when migrating to Gemini 3.8 Flash.",
      "candidate_count is unsupported in Gemini 3 and later.",
      "Prefilled model turns are unsupported; the final user turn must contain non-empty text.",
      "GenerateContent FunctionResponse objects must include call_id and name.",
      "Google documents caching as supported for Gemini 3.8 Flash; no dedicated caching field exists in the current CKB profile schema, so this remains source-backed note metadata rather than an inferred schema extension.",
      "Google documents Batch API, Flex inference, and Priority inference as supported consumption options; CKB's current profile schema has no dedicated consumption-options fields, so these remain source-backed note metadata."
    ]
  },
  "tokenizerNotes": [],
  "declaredSources": [
    {
      "kind": "official-release",
      "reference": "https://ai.google.dev/gemini-api/docs/changelog",
      "observedAt": "2026-09-03T00:00:00Z"
    },
    {
      "kind": "official-doc",
      "reference": "https://ai.google.dev/gemini-api/docs/models/gemini-3.8-flash",
      "observedAt": "2026-09-03T00:00:00Z"
    },
    {
      "kind": "official-doc",
      "reference": "https://ai.google.dev/gemini-api/docs/generate-content/latest-model",
      "observedAt": "2026-09-03T00:00:00Z"
    },
    {
      "kind": "official-doc",
      "reference": "https://ai.google.dev/gemini-api/docs/computer-use",
      "observedAt": "2026-09-03T00:00:00Z"
    }
  ]
}
